"","title","link","pubDate","Site","Lead","Symbol","Company"
"358","What Filgotinib Could Mean For Gilead&#39;s Future","http://seekingalpha.com/article/4041435-filgotinib-mean-gileads-future","2017-02-01 09:19:44","Seeking Alpha","These discussions are based, in part, on the fact that it is always difficult to evaluate, let alone value, a biotech company's pipeline. The pipeline is the key component of the future of any biotech. That pipeline can be filled by internal R&D, but ...","GILD"," Gilead"
"359","Benedict Financial Advisors Inc Buys Gilead Sciences, LyondellBasell ...","http://www.gurufocus.com/news/478910/benedict-financial-advisors-inc-buys-gilead-sciences-lyondellbasell-industries-nv-wisdomtree-high-dividend-fund-sells-siemens-ag-wells-fargo-advansix","2017-02-01 14:41:15","GuruFocus.com","Atlanta, GA, based Investment company Benedict Financial Advisors Inc buys Gilead Sciences, LyondellBasell Industries NV, WisdomTree High Dividend Fund, Phillips 66, American Express, TransCanada, C.H.","GILD"," Gilead"
"360","Earnings Preview: What To Expect From Gilead On Tuesday","http://www.forbes.com/sites/adamsarhan/2017/02/02/earnings-preview-what-to-expect-from-gilead-on-tuesday/","2017-02-02 07:19:55","Forbes","Gilead Sciences, Inc., incorporated on June 22, 1987, is a research-based biopharmaceutical company. The Company focuses on the discovery, development and commercialization of medicines in areas of unmet medical need.","GILD"," Gilead"
"361","The Case for and Against Gilead Sciences Inc (NASDAQ:GILD)","http://stocknewsjournal.com/2017/02/02/the-case-for-and-against-gilead-sciences-inc-nasdaqgild/","2017-02-02 09:37:30","StockNewsJournal","Gilead Sciences Inc. (GILD) is an interesting player in the Healthcare space, with a focus on Biotechnology. The stock has been active on the tape, currently trading at $72.82, up from yesterday's close by 0.51%.","GILD"," Gilead"
"362","3 Crucial Questions Gilead Sciences Should Answer Tuesday","https://www.fool.com/investing/2017/02/05/3-crucial-questions-gilead-sciences-should-answer.aspx","2017-02-05 08:18:45","Motley Fool","Gilead's worldwide HCV sales plummeted by 31% year over year last quarter, as lower patient starts ","GILD"," Gilead"
"363","Grisanti Capital Management LLC Buys Citigroup, DaVita, Gilead Sciences, Sells ...","http://www.gurufocus.com/news/480413/grisanti-capital-management-llc-buys-citigroup-davita-gilead-sciences-sells-cognizant-technology-solutions-medtronic-plc-allergan-plc","2017-02-06 12:37:30","GuruFocus.com","New York, NY, based Investment company Grisanti Capital Management LLC buys Citigroup, DaVita, Gilead Sciences, Skyworks Solutions, Wells Fargo, Nike, Viacom, Schlumberger, Visa, AmeriGas Partners LP, sells Cognizant Technology Solutions, ...","GILD"," Gilead"
"364","All eyes will be on Gilead&#39;s hepatitis C franchise as it reports fourth ...","http://www.marketwatch.com/story/all-eyes-will-be-on-gileads-hepatitis-c-franchise-as-it-reports-fourth-quarter-earnings-2017-02-06","2017-02-06 16:35:00","MarketWatch","Gilead Sciences Inc. first became notorious in 2014 for the high price of its hepatitis C drug Sovaldi: More than $80,000 for a course of treatment.","GILD"," Gilead"
"365","Form 4 GILEAD SCIENCES INC For: Feb 02 Filed by: Alton Gregg H","http://www.streetinsider.com/SEC+Filings/Form+4+GILEAD+SCIENCES+INC+For%3A+Feb+02+Filed+by%3A+Alton+Gregg+H/12504515.html","2017-02-06 20:52:30","StreetInsider.com","Check this box if no longer subject to Section 16. Form 4 or Form 5 obligations may continue. See Instruction 1(b). 1. Name and Address of Reporting Person *. Alton Gregg H. (Last), (First), (Middle). GILEAD SCIENCES, INC. 333 LAKESIDE DRIVE. (Street) ...","GILD"," Gilead"
"366","Some Risk Relief For Gilead Longs","http://seekingalpha.com/article/4043388-risk-relief-gilead-longs","2017-02-07 12:15:00","Seeking Alpha","As Friedrich Research noted recently, investing in Gilead and other biotechs involves more risk than investing in stocks in other industries.","GILD"," Gilead"
"367","Earnings Reaction History: Gilead Sciences Inc., 63.6% Follow-Through ...","http://www.nasdaq.com/article/earnings-reaction-history-gilead-sciences-inc-636-follow-through-indicator-40-sensitive-cm744415","2017-02-07 13:33:45","Nasdaq","Gilead Sciences Inc. ( GILD ) is due to issue its quarterly earnings report in the upcoming extended-hours session. Given its history, traders can expect very active trading in the issue immediately following its quarterly earnings announcement ...","GILD"," Gilead"
"368","Gilead Sciences reports Q4 earnings per share $2.34","http://www.reuters.com/finance/stocks/GILD.O/key-developments/article/3522142","2017-02-07 16:01:00","Reuters Key Development","Gilead Sciences reports Q4 earnings per share $2.34","GILD"," Gilead"
"369","Gilead Sciences sets quarterly dividend of $0.52 per share","http://www.reuters.com/finance/stocks/GILD.O/key-developments/article/3522141","2017-02-07 16:02:00","Reuters Key Development","Gilead Sciences sets quarterly dividend of $0.52 per share","GILD"," Gilead"
"370","Gilead Sciences Inc. Reports Q4 Earnings Decline and Worsening Outlook for 2017","https://www.fool.com/investing/2017/02/07/gilead-sciences-inc-reports-q4-earnings-decline-an.aspx","2017-02-07 18:37:30","Motley Fool","Anyone who follows Gilead Sciences was probably most interested in the company's hepatitis C virus (HCV) franchise performance in the fourth quarter.","GILD"," Gilead"
"371","Gilead: Dreadful Guidance Inspires Fear","http://seekingalpha.com/article/4043587-gilead-dreadful-guidance-inspires-fear","2017-02-07 19:53:52","Seeking Alpha","However, guidance is dreadful vs. estimates with FY17 revenue guided to be around $22.5-24.5b vs. estimates around $28b. After adjusting the DCF model I showed in a previous article, the stock is naturally less attractive, but downside risk is still ...","GILD"," Gilead"
"372","Gilead Sciences (GILD) Q4 2016 Results - Earnings Call Transcript","http://seekingalpha.com/article/4043634-gilead-sciences-gild-q4-2016-results-earnings-call-transcript","2017-02-07 22:48:52","Seeking Alpha","Non-GAAP financial measures will be used to help you understand the company's underlying business performance. The GAAP to non-GAAP reconciliations are provided in the earnings press release as well as on the Gilead website. I will now turn the call ...","GILD"," Gilead"
"373","New leadership for Gilead Sciences Canada, Inc.","http://finance.yahoo.com/news/leadership-gilead-sciences-canada-inc-132200316.html","2017-02-08 08:29:28","Yahoo Finance","8, 2017 /CNW/ - Kennet Brysting has been appointed General Manager of Gilead Sciences Canada, Inc., assuming leadership of Gilead's sixth-largest market.","GILD"," Gilead"
"374","Spot Trading LLC Buys Gilead Sciences, Allergan PLC, Bristol-Myers Squibb ...","http://www.nasdaq.com/article/spot-trading-llc-buys-gilead-sciences-allergan-plc-bristol-myers-squibb-company-sells-spdr-cm744907","2017-02-08 09:03:45","Nasdaq","Spot Trading L.L.C initiated holdings in Gilead Sciences Inc. The purchase prices were between $71.61 and $78.47, with an estimated average price of $74.33.","GILD"," Gilead"
"375","Buffalo Wild Wings, Gilead Sciences, Vertex Pharmaceuticals Downgraded","http://www.schaeffersresearch.com/content/news/2017/02/08/buffalo-wild-wings-gilead-sciences-vertex-pharmaceuticals-downgraded","2017-02-08 09:48:45","Schaeffers Research (blog)","Analysts are weighing in on sports bar Buffalo Wild Wings (NASDAQ:BWLD), as well as drug stocks Gilead Sciences, Inc. (NASDAQ:GILD) and Valeant Pharmaceuticals Intl Inc (NYSE:VRX). Here's a quick roundup of today's bearish brokerage notes on ...","GILD"," Gilead"
"376","Martin Shkreli: I Would Buy Gilead Shares","https://www.benzinga.com/general/biotech/17/02/9011449/martin-shkreli-i-would-buy-gilead-shares","2017-02-08 10:00:00","Benzinga","Investors may not have been thrilled with Gilead Sciences, Inc. (NASDAQ: GILD)'s fourth-quarter report, but Martin Shkreli was ecstatic.","GILD"," Gilead"
"377","Gilead Sciences &amp; Bristol Myers: Two Wrongs Make a Right?","http://blogs.barrons.com/stockstowatchtoday/2017/02/08/gilead-sciences-bristol-myers-two-wrongs-make-a-right/","2017-02-08 10:17:54","Barron's (blog)","Plans to Get out of Value Trap. Gilead repurchased $1bn of shares in 4Q'16, sticking to its plan of pausing on buyback to prepare for acquisitions.","GILD"," Gilead"
"378","3 Big Stock Charts for Wednesday: Gilead Sciences, Inc. (GILD), AK Steel ...","http://investorplace.com/2017/02/3-big-stock-charts-for-wednesday-gilead-sciences-inc-gild-ak-steel-holding-corporation-aks-and-sysco-corporation-syy/","2017-02-08 10:56:15","Investorplace.com","The markets are starting to split again as the earnings traders are driving a wedge between the correlation that investors like to see growth with a bull market.","GILD"," Gilead"
"379","Wednesday&#39;s Market Insights: DryShips Inc. (DRYS), Gilead Sciences, Inc. (GILD ...","https://www.smarteranalyst.com/2017/02/08/wednesdays-market-insights-dryships-inc-drys-gilead-sciences-inc-gild-galena-biopharma-gale/","2017-02-08 12:05:13","Smarter Analyst","Gilead Sciences, Inc. (NASDAQ:GILD) are trading down by 9% after the healthcare giant announced guidance for the year far below Wall Street's previous expectations.","GILD"," Gilead"
"380","Gilead Bombs - Analysis","http://seekingalpha.com/article/4043878-gilead-bombs-analysis","2017-02-08 13:33:45","Seeking Alpha","Jeremiah was generally a gloomy guy, it would seem, and choosing the name Gilead Sciences for a stock was an interesting decision.","GILD"," Gilead"
"381","Gilead Sciences, Fitbit Plunge into Wednesday&#39;s 52-Week Low Club","http://247wallst.com/investing/2017/02/08/gilead-sciences-fitbit-plunge-into-wednesdays-52-week-low-club/","2017-02-08 16:08:24","24/7 Wall St.","Gilead Sciences Inc. (NASDAQ: GILD) dropped about 10% Wednesday to post a new 52-week low of $65.75 after closing Tuesday at $73.13.","GILD"," Gilead"
"382","Gilead execs receive hefty bonuses for 2016 performance","http://seekingalpha.com/news/3241702-gilead-execs-receive-hefty-bonuses-2016-performance","2017-02-08 16:23:30","Seeking Alpha","In a regulatory filing, Gilead Sciences (NASDAQ:GILD) discloses the 2016 bonuses for senior executives and base salaries for this year.","GILD"," Gilead"
"383","Gilead Sciences and Container Store skid; Nordstrom climbs","https://www.washingtonpost.com/business/gilead-sciences-and-container-store-skid-nordstrom-climbs/2017/02/08/1f053248-ee49-11e6-a100-fdaaf400369a_story.html","2017-02-08 16:55:34","Washington Post","Nordstrom Inc., up $1.75 to $44.53. After initially slipping, the stock recovered after President Donald Trump criticized the retailer for treating his daughter “so unfairly.","GILD"," Gilead"
"384","Why Gilead Sciences, Zillow Group, and Parsley Energy Slumped Today","https://www.fool.com/investing/2017/02/08/why-gilead-sciences-zillow-group-and-parsley-energ.aspx","2017-02-08 16:56:12","Motley Fool","Despite the relatively neutral performance from the market today, some stocks fell sharply, and Gilead Sciences (NASDAQ:GILD), Zillow Group (NASDAQ:Z) (NASDAQ:ZG), and Parsley Energy (NYSE:PE) were among the worst performers on the day.","GILD"," Gilead"
"385","Gilead: A Technical Perspective","http://seekingalpha.com/article/4044356-gilead-technical-perspective","2017-02-09 11:52:30","Seeking Alpha","Gilead (NASDAQ:GILD) reported earnings on February 7th, and despite beating estimates on both the top and bottom line, it tanked.","GILD"," Gilead"
"386","Gilead, GlaxoSmithKline Race for HIV Cure (GILD,GSK)","http://www.investopedia.com/news/gilead-glaxosmithkline-race-hiv-cure-gildgsk/","2017-02-09 13:16:18","Investopedia","Gilead Sciences Inc. (GILD) will face off against GlaxoSmithKline PLC (GSK) next week when companies reveal dueling clinical results of their competing HIV drugs at an HIV conference in Seattle, Washington.","GILD"," Gilead"
"387","Gilead Could Go Lower","http://seekingalpha.com/article/4044637-gilead-go-lower","2017-02-09 21:26:15","Seeking Alpha","Since the 3rd of November last, Gilead's returns have been dismal compared to the Biotechnology Index ETF (NASDAQ:IBB) and also Pfizer Inc.(NYSE:PFE), which is a bellwether stock in this sector. Again, it wasn't necessarily the company's fourth-quarter ...","GILD"," Gilead"
"388","Gilead Sciences, Inc. (NASDAQ:GILD), GlaxoSmithKline Plc (NYSE:GSK) Battle ...","https://marketexclusive.com/gilead-sciences-inc-nasdaqgild-glaxosmithkline-plc-nysegsk-battle-head-hiv-treatment/71599/","2017-02-10 09:37:30","Market Exclusive","Gilead Sciences, Inc. (NASDAQ:GILD) and GlaxoSmithKline Plc (NYSE:GSK) will battle head-on in a coming HIV/AIDS conference to reveal clinical test trial results for HIV treatment.","GILD"," Gilead"
"389","Gilead&#39;s travails good for biotech says JPMorgan&#39;s Kasimov","http://seekingalpha.com/news/3242568-gileads-travails-good-biotech-says-jpmorgans-kasimov","2017-02-10 11:18:44","Seeking Alpha","Gilead Sciences' (GILD +1.3%) recent plunge after releasing disappointing guidance appears to be a plus for biotech says Barron's Ben Levisohn.","GILD"," Gilead"
"390","Gilead Sciences Will More Than Survive 2017","http://seekingalpha.com/article/4044896-gilead-sciences-will-survive-2017","2017-02-10 12:48:45","Seeking Alpha","Gilead Sciences (NASDAQ: GILD) investors had some reason to celebrate when the biotech company reported fourth quarter and full year earnings on Tuesday.","GILD"," Gilead"
"391","Holowesko Partners Ltd. Buys Wells Fargo, Gilead Sciences, PulteGroup, Sells ...","http://www.nasdaq.com/article/holowesko-partners-ltd-buys-wells-fargo-gilead-sciences-pultegroup-sells-citizens-financial-cm746504","2017-02-10 15:15:00","Nasdaq","Holowesko Partners Ltd. added to the holdings in Gilead Sciences Inc by 100.38%. The purchase prices were between $71.61 and $78.47, with an estimated average price of $74.33.","GILD"," Gilead"
"392","Better Buy: Illumina or Gilead Sciences?","https://www.fool.com/investing/2017/02/13/better-buy-illumina-or-gilead-sciences.aspx","2017-02-13 13:00:00","Motley Fool","Illumina (NASDAQ:ILMN) and Gilead Sciences (NASDAQ:GILD) are healthcare goliaths that are disrupting their industries, and each of these companies has catalysts on deck that could reward investors in the future.","GILD"," Gilead"
"393","Why I Just Bought More Shares of Gilead Sciences, Inc.","https://www.fool.com/investing/2017/02/14/why-i-just-bought-more-shares-of-gilead-sciences-i.aspx","2017-02-14 08:18:45","Motley Fool","So you might be wondering why I was so quick to scoop up more shares of Gilead Sciences (NASDAQ:GILD) stock after its latest earnings report.","GILD"," Gilead"
"394","Gilead Will Free-Fall In Spite Of Carl Icahn","http://seekingalpha.com/article/4045702-gilead-will-free-fall-spite-carl-icahn","2017-02-14 09:15:00","Seeking Alpha","GILD's HCV sales (45% of product sales) are in free fall. HIV (47% of product sales) could be next. GSK and JNJ have a two-drug HIV combo that measured up to three and four-drug combos on efficacy.","GILD"," Gilead"
"395","The Zacks Analyst Blog Highlights: Gilead Sciences, Celgene, Fate Therapeutics ...","http://finance.yahoo.com/news/zacks-analyst-blog-highlights-gilead-143002852.html","2017-02-14 10:18:50","Yahoo Finance","Biotech major, Gilead Sciences Inc. (NASDAQ: GILD- Free Report ), reported better-than-expected results for the fourth quarter of 2016 ","GILD"," Gilead"
"396","Gilead Sciences, Inc. (GILD): Bictegravir HIV Data Looks Good","https://www.smarteranalyst.com/2017/02/14/gilead-sciences-inc-gild-bictegravir-hiv-data-looks-good/","2017-02-14 10:45:00","Smarter Analyst","Gilead Sciences, Inc. (NASDAQ:GILD) announced yesterday positive phase 2 results for bictegravir vs. GSK/ViiV's dolutegravir (Tivicay) in combination with F/TAF in treatment naive HIV patients.","GILD"," Gilead"
"397","Gilead Sciences, Inc. (NASDAQ:GILD) Announces Preclinical Study Results Of HIV ...","http://www.financialstrend.com/gilead-sciences-inc-nasdaqgild-announces-preclinical-study-results-of-hiv-capsid-inhibitors-25743.html","2017-02-15 05:41:15","FinancialsTrend","On February 13th 2017, Gilead Sciences, Inc. (NASDAQ:GILD) announced the preclinical study results on HIV capsid inhibitors (CAI) evaluation as an antiretroviral treatment (ARV).","GILD"," Gilead"
"398","Will Gilead Buy Bristol-Myers Squibb?","http://seekingalpha.com/article/4046183-will-gilead-buy-bristol-myers-squibb","2017-02-15 09:26:15","Seeking Alpha","Gilead (NASDAQ:GILD) has hit new multi year lows after the company reported its fourth quarter results and provided guidance for the current year that sees revenues and earnings coming in well below what analysts have been estimating for 2017.","GILD"," Gilead"
"399","Amygdala Neurosciences Acquires GS-6637 from Gilead Sciences","http://www.prnewswire.com/news-releases/amygdala-neurosciences-acquires-gs-6637-from-gilead-sciences-300408827.html","2017-02-16 10:00:00","PR Newswire (press release)"," Amygdala Neurosciences Inc., a biopharmaceutical company focused on the development and commercialization of first-in-class drug candidates for addiction disorders, has entered into an agreement with ...","GILD"," Gilead"
"400","AMYGDALA NEUROSCIENCES ACQUIRES GS-6637 FROM GILEAD SCIENCES","http://www.reuters.com/finance/stocks/GILD.O/key-developments/article/3529598","2017-02-16 10:03:00","Reuters Key Development","AMYGDALA NEUROSCIENCES ACQUIRES GS-6637 FROM GILEAD SCIENCES","GILD"," Gilead"
"401","Robin L. Washington of Gilead Sciences, Inc. selected for Bay Area CFO of the ...","http://finance.yahoo.com/news/robin-l-washington-gilead-sciences-160000057.html","2017-02-16 11:05:35","Yahoo Finance","(Marketwired - February 16, 2017) - The independent selection panel of the 12th Annual Bay Area CFO of the Year Awards is proud to announce their 2017 Hall of Fame Lifetime Achievement Award winner: Robin L. Washington, ...","GILD"," Gilead"
"402","Gilead receives approval in Canada for Odefsey for treatment of HIV-1 infection","http://www.reuters.com/finance/stocks/GILD.O/key-developments/article/3529632","2017-02-16 11:30:00","Reuters Key Development","Gilead receives approval in Canada for Odefsey for treatment of HIV-1 infection","GILD"," Gilead"
"403","Is AbbVie The Next Gilead?","http://seekingalpha.com/article/4046999-abbvie-next-gilead","2017-02-16 21:15:00","Seeking Alpha","AbbVie Inc. (NYSE:ABBV) and Gilead Sciences Inc. (NASDAQ:GILD) are both large-cap pharma companies with market caps of $98.84 billion and $91.44 billion, respectively.","GILD"," Gilead"
"404","Gilead&#39;s HCV Guidance Wasn&#39;t Sandbagged","http://seekingalpha.com/article/4047123-gileads-hcv-guidance-sandbagged","2017-02-17 09:22:50","Seeking Alpha","HCV revenue has seen sharp declines in the last year, and guidance suggests it won't be better for FY'17. Investors struggle to value effectively lumpy cash flow businesses due to the desire for steady cash flow generation and revenue growth ...","GILD"," Gilead"
"405","Why President Trump Should Buy Gilead Sciences","https://www.fool.com/investing/2017/02/17/why-president-trump-should-buy-gilead-sciences.aspx","2017-02-17 13:56:15","Motley Fool","Problem is, right now, not a lot of folks on Wall Street do think Gilead Sciences is a great deal. Thanks to the company's rapidly evaporating HCV franchise, analysts currently predict at least five straight years of precisely 0% profits growth at ...","GILD"," Gilead"
"406","Equity Perception: Analyst&#39;s Indicator Review for Gilead Sciences Inc. (GILD ...","http://theusacommerce.com/2017/02/20/equity-perception-analysts-indicator-review-for-gilead-sciences-inc-gild-starbucks-corporation-sbux/","2017-02-20 11:30:00","The USA Commerce","Shares of Gilead Sciences Inc. (NASDAQ:GILD) dropped -0.65% to $69.85. During the trading on 02/17/2017, Company's stock ranged from $69.71 to $70.79.","GILD"," Gilead"
"407","Sarepta Therapeutics, Inc. (NASDAQ:SRPT) Announces $125 Deal with Gilead ...","http://stocknewsunion.com/sarepta-therapeutics-inc-nasdaqsrpt-announces-125-deal-with-gilead-sciences-inc-gild/1999/","2017-02-21 08:52:30","StockNewsUnion","Sarepta Therapeutics, Inc. (NASDAQ:SRPT) announced it has entered into an agreement with Gilead Sciences, Inc. (NASDAQ:GILD) to sell its Rare Pediatric Disease Priority Review Voucher (PRV) for $125 million.","GILD"," Gilead"
"408","Gilead: The Catalyst We Were Waiting For?","http://seekingalpha.com/article/4047853-gilead-catalyst-waiting","2017-02-21 11:52:30","Seeking Alpha","Gilead has recently tested the three-year low, due to a weak guidance for 2017 and declining HCV sales. The only way the company can unlock revenue growth is through diversification in other areas, such as NASH and IBD. There is a catalyst on the ...","GILD"," Gilead"
"409","Checking Out the Technicals for Gilead Sciences Inc. (GILD)","http://theusacommerce.com/2017/02/21/checking-out-the-technicals-for-gilead-sciences-inc-gild/","2017-02-21 14:52:30","The USA Commerce","We have gathered the technical data on Gilead Sciences Inc. (GILD), and see some interesting trends in the stock's behavior of late.","GILD"," Gilead"
"410","Form 4 GILEAD SCIENCES INC For: Feb 15 Filed by: Washington Robin L","http://www.streetinsider.com/SEC+Filings/Form+4+GILEAD+SCIENCES+INC+For%3A+Feb+15+Filed+by%3A+Washington+Robin+L/12575712.html","2017-02-21 21:15:00","StreetInsider.com","Get the Pulse of the Market with StreetInsider.com's Pulse Picks. Get your Free Trial here. FORM 4, UNITED STATES SECURITIES AND EXCHANGE COMMISSION Washington, D.C.","GILD"," Gilead"
"411","Gilead&#39;s M&amp;A Growth Strategies Becoming Increasingly Limited","http://seekingalpha.com/article/4048212-gileads-m-growth-strategies-becoming-increasingly-limited","2017-02-22 08:41:15","Seeking Alpha","Shares of Gilead Sciences (NASDAQ:GILD) have underperformed the iShares Nasdaq Biotechnology ETF (NASDAQ:IBB), which tracks the total return performance of the Nasdaq Biotechnology Index (NASDAQ:NBI), by some 13 percentage points so far this year on ...","GILD"," Gilead"
"412","Gilead: Is Management The Issue?","http://seekingalpha.com/article/4048289-gilead-management-issue","2017-02-22 10:00:00","Seeking Alpha","It has been a rough two years for shareholders of Gilead Sciences (NASDAQ:GILD), although the stock's five-year performance is still rock solid.","GILD"," Gilead"
"413","Analytical Guide for Abbott Laboratories (ABT), Gilead Sciences Inc. (GILD ...","http://theusacommerce.com/2017/02/22/analytical-guide-for-abbott-laboratories-abt-gilead-sciences-inc-gild-stakeholders/","2017-02-22 10:56:15","The USA Commerce","Shares of Abbott Laboratories (NYSE:ABT) surged 0.72% to $45.01. During the trading on 02/21/2017, Company's stock ranged from $44.54 to $45.15.","GILD"," Gilead"
"414","Gilead Sciences Canada says Ontario to list Epclusa on public drug plan to treat all six genotypes of chronic Hepatitis C infection","http://www.reuters.com/finance/stocks/GILD.O/key-developments/article/3533070","2017-02-22 11:36:00","Reuters Key Development","Gilead Sciences Canada says Ontario to list Epclusa on public drug plan to treat all six genotypes of chronic Hepatitis C infection","GILD"," Gilead"
"415","Cramer&#39;s lightning round: Why Gilead could be a value trap","http://www.cnbc.com/2017/02/22/cramers-lightning-round-why-gilead-could-be-a-value-trap.html","2017-02-22 19:22:30","CNBC","Incyte Corporation: ""Let me give you some incite about Incyte, I think this company is incredibly undervalued because they have got a great pipeline and they actually make a lot of money.","GILD"," Gilead"
"416","Undervalued Gilead Sciences – FCF/EV Yield 30%, Shareholder Yield 17%","http://www.valuewalk.com/2017/02/undervalued-gilead-sciences-fcfev-yield-30-shareholder-yield-17/","2017-02-23 08:18:45","ValueWalk","One of the cheapest stocks in our all All Investable - Stock Screener is Gilead Sciences, Inc. (NASDAQ:GILD). Gilead Sciences, Inc. (Gilead) is a research-based biopharmaceutical company. The company focuses on the discovery, development and ...","GILD"," Gilead"
"417","The Technical Facts on Gilead Sciences Inc. (GILD)","http://theusacommerce.com/2017/02/23/the-technical-facts-on-gilead-sciences-inc-gild-3/","2017-02-23 13:45:00","The USA Commerce","We have gathered the technical data on Gilead Sciences Inc. (GILD), and see some interesting trends in the stock's behavior of late.","GILD"," Gilead"
"418","Gilead Sciences Inc. (GILD) Shouts Loudly With Its Technical Chart","http://nystocknews.com/2017/02/23/gilead-sciences-inc-gild-shouts-loudly-with-its-technical-chart/","2017-02-23 14:07:30","NY Stock News","The technicals for Gilead Sciences Inc. (GILD) have taken shape, and with them a comprehensive picture has emerged. This is the current state of play as presented by the current technical setup.","GILD"," Gilead"
"419","Gilead&#39;s strategy to deal with the EU patent of TDF expiring is to switch ...","http://seekingalpha.com/article/4049323-gilead-hcv-problem","2017-02-24 09:06:21","Seeking Alpha","I can hear your sigh of relief, for this week, we'll explore Gilead's (NASDAQ:GILD) thriving HIV business rather than the dreadful HCV business we covered last week.","GILD"," Gilead"
"420","Latest Updates :Gilead Sciences Inc.&#39;s (GILD) stock price is Worth at $69.94 ...","http://www.hotstockspoint.com/latest-updates-gilead-sciences-inc-s-gild-stock-price-worth-69-94-analysts-mean-rating-score-stands-2-30/","2017-02-27 07:30:02","Hot Stocks Point","Gilead Sciences Inc.'s (GILD) stock price ended its day with a gain of 0.82% and finalized at the price of $69.94. During its last trading session, Stock traded with the total exchanged volume of 7.37 million shares.","GILD"," Gilead"
